{
  "$schema": "http://json-schema.org/draft-07/schema#",
  "title": "Pocket Network Supported Chains Registry",
  "description": "Registry of blockchain networks accessible through Pocket Network's public RPC endpoints. Used by the POKT MCP server for chain discovery and dispatch.",
  "type": "object",
  "required": ["version", "updated_at", "gateway_base_url", "chains"],
  "properties": {
    "$schema": {
      "type": "string",
      "description": "Path to this schema file"
    },
    "version": {
      "type": "string",
      "pattern": "^\\d+\\.\\d+\\.\\d+$",
      "description": "Semver version of the registry file"
    },
    "updated_at": {
      "type": "string",
      "pattern": "^\\d{4}-\\d{2}-\\d{2}$",
      "description": "ISO 8601 date when the registry was last updated"
    },
    "gateway_base_url": {
      "type": "string",
      "format": "uri",
      "description": "Base URL for the Pocket Network public gateway"
    },
    "chains": {
      "type": "array",
      "description": "List of supported blockchain networks",
      "items": {
        "$ref": "#/definitions/chain"
      }
    }
  },
  "additionalProperties": false,
  "definitions": {
    "chain": {
      "type": "object",
      "required": ["name", "slug", "protocol", "url", "network"],
      "properties": {
        "name": {
          "type": "string",
          "description": "Human-readable chain name (e.g. 'Ethereum', 'Arbitrum Sepolia')"
        },
        "slug": {
          "type": "string",
          "pattern": "^[a-z0-9][a-z0-9-]*$",
          "description": "URL slug used in the RPC endpoint path (e.g. 'eth', 'arb-one', 'base-sepolia-testnet')"
        },
        "protocol": {
          "type": "string",
          "enum": ["evm", "cosmos", "solana", "sui", "near", "tron", "radix"],
          "description": "Protocol family determining which RPC methods and dispatch mode to use"
        },
        "url": {
          "type": "string",
          "format": "uri",
          "pattern": "^https://[a-z0-9-]+\\.api\\.pocket\\.network$",
          "description": "Full RPC endpoint URL (e.g. 'https://eth.api.pocket.network')"
        },
        "network": {
          "type": "string",
          "enum": ["mainnet", "testnet"],
          "description": "Network type"
        },
        "evm_compatible": {
          "type": "boolean",
          "default": false,
          "description": "If true, this chain accepts standard eth_* JSON-RPC methods via an EVM compatibility layer, even though its native protocol is not EVM. EVM handler tools will accept this chain."
        },
        "status": {
          "type": "string",
          "enum": ["active", "inactive", "degraded"],
          "default": "active",
          "description": "Operational status. 'inactive' means no active suppliers; 'degraded' means probes are failing but the chain may recover."
        },
        "notes": {
          "type": "string",
          "description": "Optional free-text notes about the chain's configuration, quirks, or status."
        }
      },
      "additionalProperties": false
    }
  }
}
